{"asset_id": "synthetic-asset-001", "data_origin": "synthetic", "dataset_type": "history", "evidence_id": "ev_synthetic000000000001", "measurement_name": "Phase A current", "measurement_point_id": "synthetic-point-1", "measurement_type_code": "A_phsA", "measurement_value": 42.5, "measurement_value_status": "present", "normalized_unit": null, "observed_at_original": "2026-08-24 12:00:00", "observed_at_timezone": null, "original_unit": null, "quality_flags": "synthetic fixture", "quality_status": "valid", "sampling_method": null, "schema_version": "1.0.0", "source_ref": {"checksum_sha256": null, "extraction_method": "synthetic_fixture_v1", "source_file_id": "synthetic_fixture.json", "source_record_index": 0, "source_uri": null}, "timezone_status": "unconfirmed", "unit_status": "unconfirmed", "validation_reason": null}
